[
  {
    "id": "audio-1986",
    "year": "1986",
    "event": "Запись аудиокниги",
    "description": "Евгений Кривецкий записывает избранные главы Рамаяны. Эта запись станет основой для аудио-архива проекта.",
    "source": "Частная аудиозапись Е. Кривецкого (архив проекта)"
  },
  {
    "id": "lp-1-2-2006",
    "year": "2006",
    "event": "Издание Книг I-II",
    "description": "В серии «Литературные памятники» выходят первые две книги в переводе П.А. Гринцера.",
    "source": "Рамаяна. Кн. I–II / пер. П. А. Гринцера. М.: Ладомир : Наука, 2006. (Литературные памятники)"
  },
  {
    "id": "lp-3-2014",
    "year": "2014",
    "event": "Издание Книги III",
    "description": "Публикация «Араньяканды» (Лесной книги) под редакцией П.А. Гринцера.",
    "source": "Рамаяна. Кн. III: Араньяканда. М.: Ладомир : Наука, 2014. ISBN 978-5-86218-522-5"
  },
  {
    "id": "portal-2026",
    "year": "2026",
    "event": "Цифровой корпус и краудфандинг",
    "description": "Запуск сайта «Русская Рамаяна», объединяющего все переводы и открывающего сбор средств на завершение проекта.",
    "source": "Проект «Русская Рамаяна»"
  },
  {
    "id": "lp-5-2027-planned",
    "year": "2027",
    "event": "Планируемый выход Книги V",
    "description": "Ориентировочный срок подготовки рукописи «Сундараканды» Максимом Леоновым.",
    "source": "Оценка проекта (М. В. Леонов); срок ориентировочный"
  },
  {
    "id": "lp-6-2029-planned",
    "year": "2029",
    "event": "Планируемый выход Книги VI",
    "description": "Завершение работы над «Юддха-кандой» и подготовка полного академического издания.",
    "source": "Оценка проекта (М. В. Леонов); срок ориентировочный"
  }
]
